{
  "$schema": "schema/research-collection-v1.schema.json",
  "schema_version": "research-collection/v1",
  "collection_id": "research-collection:ice-orca-dragon",
  "title": "ICE ORCA DRAGON research memory collection",
  "description": "Catalog of independent repository-local research graphs. It preserves programme boundaries and adds qualified navigation paths without turning cross-programme proximity into evidence, derivation, or physics promotion.",
  "updated_at_utc": "2026-09-06T17:12:49Z",
  "canonical_file": "ontology/collection.json",
  "default_graph": "cpt",
  "graphs": [
    {
      "key": "hypercomplex",
      "graph_id": "research-graph:hypercomplex",
      "path": "ontology/hypercomplex/graph.json",
      "guide": "ontology/hypercomplex/README.md",
      "entry_node": "programme:hypercomplex-hypothesis-testbench",
      "coverage": "PARTIAL",
      "corpus_roots": [
        "research/hypercomplex",
        "avenue3_decisive_test_2026-06-05",
        "claimB_loop",
        "aut_direct_product_test_2026-07-12",
        "wilmot_theta_preservation_test_2026-07-12"
      ],
      "includes": [
        "representative finite Cayley-Dickson and sedenion structure claims",
        "projected closure, portability, toy-potential, g2, S3, and XOR verdicts",
        "selected Avenue-3 exact-count sources and report needed to disambiguate 42/84/168",
        "selected audit and provenance artifacts needed to interpret those verdicts",
        "ClaimB finite n=4-7 stability controls and the scoped infinite-tower boundary",
        "direct S3 action and Wilmot theta-preservation calculations"
      ],
      "excludes": [
        "an exhaustive node for every historical result JSON",
        "a Standard Model embedding or automatic physics interpretation",
        "external KG ratification"
      ]
    },
    {
      "key": "legacy",
      "graph_id": "research-graph:legacy-predictions",
      "path": "ontology/legacy-predictions/graph.json",
      "guide": "ontology/legacy-predictions/README.md",
      "entry_node": "programme:ice-legacy-predictions",
      "coverage": "PARTIAL",
      "corpus_roots": [
        "research/legacy_predictions"
      ],
      "includes": [
        "user-primary narrative sources as source nodes rather than evidence artifacts",
        "mass, dimensionless, P01-P15, gravity, hidden-scan, and provenance verdicts",
        "formalization and quotation-provenance open problems"
      ],
      "excludes": [
        "a claim that preservation of the narrative proves physics",
        "an exhaustive archive of every conversation-derived phrase",
        "untracked sibling files as repository artifacts"
      ]
    },
    {
      "key": "cpt",
      "graph_id": "research-graph:cpt-temporal-folded-susy",
      "path": "ontology/cpt-temporal-folded-susy/graph.json",
      "guide": "ontology/cpt-temporal-folded-susy/README.md",
      "entry_node": "programme:cpt-temporal-folded-susy",
      "coverage": "DETAILED",
      "corpus_roots": [
        "cpt_temporal_folded_susy",
        "formal/cpt_sewing"
      ],
      "includes": [
        "Phase 11-56 claims, evidence snapshots or historical provenance pointers, scopes, policies, and open gates",
        "the Phase 11-15R collar-to-interface-to-charge-to-parent lineage, including the Phase 15A invalid-sequence break",
        "the bounded Phase-56 terminal diagnostic and hard stop on its numbered reconciliation descendants, alongside generic bounded unnumbered science",
        "the Gate-1 phase-locked branch, principal affine phase-band reduction, consumed nonzero-arm scalar source-link result, consumed invalid zero-lapse attempt, finite bosonic single-lateral obstruction and declared complex-ray pushforward, local homogeneous trace-gauge reduction, unchanged-source append KILL, one closed-FRW V0 classical local on-shell relational endpoint action, its exact classical U_plus componentwise off-shell Darboux continuation, the compact-interior principal momentum-FIO KEEP and uncorrected one-term exact-unitarity KILL, one local improved-static BFV zero-mode replacement-source algebra KEEP, and the user-directed V0 chain through a selected densitized Liouville Fourier--KL RAQ model; its cutoff p=0 boundary excludes a nonzero-edge witness and leaves finite-part reference scale noncanonical, while the selected-H full-real-p regular shell completes to L2(R,dx)_plus direct-sum L2(R,dx)_minus with p=0 at x=-infinity and no inherited origin atom or branch gluing; one selected constant-boundary raw-C direct integral has lambda-zero Bessel/Green/Gamma_1 certificates, a bracket-1 actual nonzero-lambda family with a complete but enormous zero-containing coarse Gamma_1 enclosure, a sharp actual-direction transfer with sub-quarter but zero-containing Gamma_1 proxy widths, and a separate Q=4 entering-sensitivity anchor that excludes zero. A later normalized sign strip and fixed-lambda theorem close existence, uniqueness, kappa transversality and a continuous selector on one small real corridor. A fixed-UHP p=0 complex Volterra theorem now closes tail contraction, normalized recessive-solution uniqueness and an actual Q_plus=4 pair enclosure; Q_plus-to-Q0 transport, endpoint maps, the nonreal endpoint-to-m(z)-to-measure chain, p-to-zero threshold, raw-C RAQ and rescaling equivalence remain open. The selected-H endpoint result is NARROW because an exact p-preserving intertwiner needs a support-restricted target rather than unrestricted M_c; a finite positive-lambda odd Pfaffian transport is relative only and leaves an absolute BFV measure open; and the unit-S3 lane contains a kinematic L=2 scalar product/remainder ledger, one fixed-background zonal V0 matter HH packet, an n=1 trace-only convention with no independent shear pair, a mixed-parity fixed-metric matter-only DH falsifier, and one selected Q2 metric-plus-matter ambient DH cancellation with its L=2 omitted k=3 remainder retained. Complete SVT/cubic constraints, general combined DD/DH/HH, projected Jacobi and full gravitational Stage 5B through Stage 8 remain open or blocked. No result authorizes physics, TOE, or automatic_next",
        "the Bessel-anchored Q0 projective sensitivity and complete Q0-normalized quotient certificates, correlated at-least-one-zero sign strip, strict-negative kappa projective-sensitivity chain, finite two-sided Q0 seed, fixed-reference weighted envelope, the 2026-09-01 complete combined differentiated minus tail with a strict-positive normalized G_kappa interval, and its fixed-lambda theorem composition into one unique kappa-transverse normalized-G zero plus a continuous selector on the declared slab; joint-C1 selector regularity, partial_lambda G, velocity, roots outside the corridor and actual Gamma_1 amplitude/orientation remain open",
        "the P4 boundary-coordinate and dependency design plus its first completed typed unit: a p=0 fixed-UHP complex-tail theorem and actual Q_plus pair enclosure. The remaining blockers begin with validated Q_plus-to-Q0 transport and endpoint maps, then continue through the selected m(z), compact nonzero-p Weyl field, fiber measure/transform, p-to-zero global assembly, raw-C RAQ and C/H comparison; the design reuses the existing selected Gamma_1=0 direct-integral extension and keeps finite M_cut separate from the conditional Herglotz normalization m=-1/(2*hbar^2*M)",
        "selected philosophy records as non-evidential artifacts",
        "the V0 formula-to-philosophy ontology map and explicit eight-stage quantum-gravity research frontier"
      ],
      "excludes": [
        "authorization for Phase 57 or a new reconciliation route",
        "a closed Gate 1 or a global Picard-Lefschetz coefficient",
        "a physics or TOE promotion"
      ]
    },
    {
      "key": "igrueqft",
      "graph_id": "research-graph:igrueqft-locality",
      "path": "ontology/igrueqft-locality/graph.json",
      "guide": "ontology/igrueqft-locality/README.md",
      "entry_node": "programme:igrueqft-locality-audit",
      "coverage": "DETAILED",
      "corpus_roots": [
        "igrueqft_locality_falsifier_2026-07-12"
      ],
      "includes": [
        "one finite N=64 free-U(1) charge-dephasing locality oracle and its scoped negative result",
        "hash-pinned producer, result, adversarial audit, and source-boundary report",
        "the distinction between failure of the recorded bulk-locality shortcut and the still-open interacting continuum programme"
      ],
      "excludes": [
        "a universal thermodynamic-limit theorem or complete proposal-specific action",
        "general validation or refutation of every IG-RUEQFT realization",
        "ICE equivalence, physics or TOE promotion, or external KG ratification"
      ]
    }
  ],
  "quick_answers": [
    {
      "question": "Is ICE ORCA DRAGON one undifferentiated knowledge graph?",
      "answer": "No. Hypercomplex algebra, legacy prediction/narrative history, CPT temporal-folded SUSY, and an independent IG-RUEQFT locality audit remain separate graphs. This collection supplies only qualified navigation between them.",
      "refs": [
        {
          "graph": "hypercomplex",
          "node": "programme:hypercomplex-hypothesis-testbench"
        },
        {
          "graph": "legacy",
          "node": "programme:ice-legacy-predictions"
        },
        {
          "graph": "cpt",
          "node": "programme:cpt-temporal-folded-susy"
        },
        {
          "graph": "igrueqft",
          "node": "programme:igrueqft-locality-audit"
        }
      ]
    },
    {
      "question": "What survives in the hypercomplex programme?",
      "answer": "Several finite algebraic structures survive in their declared convention, including the assessor orbit chain, XOR regularity, finite identities, and an explicit S3 subgroup. The currently indexed hypercomplex subset does not establish Standard Model referents.",
      "refs": [
        {
          "graph": "hypercomplex",